job_role,course_name,course_link,difficulty_level,category,job_role_encoded,course_name_encoded,category_encoded
Quantum Cryptography Engineer,The Introduction to Quantum Computing,https://xpro.mit.edu/courses/course-v1:xPRO+QCFx1/,Intermediate,Quantum Computing,428,1104,467
Quantum Cryptography Specialist,Quantum Cryptography,https://www.edx.org/course?search_query=Quantum+Cryptography,Advanced,Quantum Cryptography,429,957,470
Quantum Internet Engineer,Introduction to Quantum Optics,https://ocw.mit.edu/courses/8-421-atomic-and-optical-physics-i-spring-2014/pages/syllabus/,Advanced,Quantum Optics,430,665,471
Quantum Sensor Engineer,Quantum Theory I,https://ocw.mit.edu/courses/8-321-quantum-theory-i-fall-2017/,Advanced,Quantum Theory,431,958,473
Quantum Sensor Engineer,Atomic and Optical Physics II,https://ocw.mit.edu/courses/8-422-atomic-and-optical-physics-ii-spring-2013/video_galleries/video-lectures/,Advanced,Quantum Optics,431,146,471
Quantum Software Developer,Programming a Quantum Computer with Qiskit,https://qiskit.org/learn/course/basics-programming-with-qiskit,Intermediate,Quantum Computing/Programming,432,945,469
Quantum Software Developer,Building Quantum Applications with Cirq,https://quantumai.google/cirq/tutorials,Intermediate,Quantum Computing/Programming,432,205,469
Quantum Software Developer,Cirq: A Python Framework for Quantum Computing,https://quantumai.google/cirq,Advanced,Quantum Programming,432,281,472
Quantum Software Engineer,Programming a Quantum Computer with Qiskit,https://qiskit.org/textbook/preface.html,Intermediate,Quantum Computing,433,945,467
Quantum Software Engineer,The Building Blocks of a Quantum Computer: Part 1,https://www.edx.org/course/the-building-blocks-of-a-quantum-computer-part-1,Advanced,Quantum Computing,433,1093,467
Quantum Software Testing Engineer,Python for Test Automation,https://testautomationu.applitools.com/python-tutorial/,Intermediate,Test Automation,434,956,547
Quantum Software Testing Engineer,Black-Box and White-Box Testing,https://www.guru99.com/black-box-testing.html,Beginner,Software Testing,434,174,522
Ransomware Analyst,Incident Response to Ransomware Attacks,https://www.sans.org/courses/for508-incident-response-ransomware-attacks,Intermediate,Cybersecurity,435,593,142
Ransomware Analyst,Cybersecurity Threat Intelligence,https://www.sans.org/courses/sec487-practical-threat-intelligence,Intermediate,Cybersecurity,435,349,142
Ransomware Analyst,Malware Analysis Fundamentals,https://www.sans.org/courses/malware-analysis-essentials,Intermediate,Cybersecurity,435,754,142
Ransomware Protection Engineer,Incident Response and Threat Hunting,https://www.coursera.org/specializations/google-it-support,Intermediate,Cybersecurity,436,592,142
Ransomware Protection Engineer,Cybersecurity Fundamentals,https://www.sans.org/cyber-security-courses/foundations/,Beginner,Cybersecurity,436,346,142
React Developer,Modern React with Redux [2024 Update],https://www.udemy.com/course/react-redux/,Intermediate,Web Development,437,824,578
React Developer,Testing React with Jest and Testing Library,https://testing-library.com/docs/react-testing-library/intro,Intermediate,Web Development,437,1088,578
React Developer,Advanced React and GraphQL,https://advancedreact.com/,Advanced,Web Development,437,86,578
React Developer,Epic React by Kent C. Dodds,https://epicreact.dev/,Intermediate/Advanced,Web Development,437,449,578
React Native Developer,The Complete React Native + Hooks Course,https://www.udemy.com/course/the-complete-react-native-and-redux-course/,Beginner,Mobile Development,438,1101,398
React Native Developer,Advanced React and Redux: Mastering Modern JavaScript UI Development,https://www.udemy.com/course/react-redux-tutorial/,Intermediate,Web Development,438,87,578
Real-Time AI Decisioning Engineer,MLOps (Machine Learning Operations) Fundamentals,https://www.cloudacademy.com/course/mlops-machine-learning-operations-fundamentals-2387/,Intermediate,Machine Learning Operations,439,742,380
Real-Time Data Processing Engineer,Real-Time Analytics with Apache Flink,https://www.udemy.com/course/apache-flink/,Intermediate,Data Engineering,440,966,186
Real-Time Data Processing Engineer,Real-time Data Processing using Apache Kafka and Spark Streaming,https://cognitiveclass.ai/courses/real-time-data-processing,Intermediate,Data Engineering,440,969,186
Real-Time Kernel Developer,Advanced Operating Systems,https://www.udacity.com/course/advanced-operating-systems--ud189,Advanced,Operating Systems,441,79,429
Real-Time Operating System (RTOS) Developer,RTOS Fundamentals and How to Use Them,https://www.edx.org/course/real-time-bluetooth-networks-shape-the-world,Intermediate,Embedded Systems,442,960,291
Real-Time Streaming Data Engineer,Apache Kafka Streams - Building Stream Processing Applications,https://www.udemy.com/course/apache-kafka-streams/,Intermediate,Big Data Engineering,443,121,40
Real-Time Systems Developer,Mastering Embedded Linux,https://bootlin.com/training/embedded-linux/,Intermediate,Operating Systems/Embedded Linux,444,765,430
Real-Time Web Analytics Developer,Introduction to WebSockets,https://www.udacity.com/course/intro-to-html-and-css--ud304,Beginner,Web Development,445,683,578
Real-Time Web Analytics Developer,Google Analytics 4 (GA4) Course - Beginner to Advanced,https://www.udemy.com/course/google-analytics-4-course/,Beginner to Intermediate,Web Analytics,445,512,576
Real-Time Web Analytics Developer,Google Analytics Individual Qualification,https://skillshop.exceedlms.com/student/path/2122-google-analytics-individual-qualification,Beginner,Web Analytics,445,513,576
Real-Time Web Analytics Developer,Real-time Data Pipelines with Apache Kafka,https://www.cloudacademy.com/course/real-time-data-pipelines-with-apache-kafka-2386/,Intermediate,Data Engineering/Real-time Analytics,445,968,188
Regression Tester,API Testing with Postman,https://www.udemy.com/course/api-testing-with-postman/,Intermediate,API Testing,446,18,20
Reinforcement Learning Engineer,Reinforcement Learning Specialization,https://www.coursera.org/specializations/reinforcement-learning,Intermediate,Artificial Intelligence,447,975,29
Reinforcement Learning Engineer,Deep Reinforcement Learning Nanodegree,https://www.udacity.com/course/deep-reinforcement-learning-nanodegree--nd893,Advanced,Artificial Intelligence,447,384,29
Remote Debugging Engineer,Mastering Chrome Developer Tools,https://www.udemy.com/course/mastering-chrome-developer-tools/,Intermediate,Web Development/Debugging,448,762,592
Remote Debugging Engineer,Remote Debugging with Visual Studio,https://learn.microsoft.com/en-us/visualstudio/debugger/remote-debugging?view=vs-2022,Intermediate,Software Development/Debugging,448,976,512
Remote Debugging Engineer,Chrome DevTools: Remote Debugging on Android Devices,https://developer.chrome.com/docs/devtools/remote-debugging/,Intermediate,Web Development/Debugging,448,279,592
Remote Debugging Engineer,Network Programming and Socket Debugging,https://www.udemy.com/course/python-network-programming/,Intermediate,Network Programming/Debugging,448,871,417
Remote Rural Connectivity Engineer,Introduction to EECS II: Digital Communication Systems,https://ocw.mit.edu/courses/electrical-engineering-and-computer-science/6-02-introduction-to-eecs-ii-digital-communication-systems-fall-2012/,Intermediate,Telecommunications,449,633,544
Responsible AI Engineer,Building Robust Machine Learning Models,https://developers.google.com/machine-learning/testing-debugging,Intermediate,AI Robustness and Reliability,450,208,11
Responsive Web Motion Designer,Web Design for Beginners: Real World Coding in HTML & CSS,https://www.udemy.com/course/web-design-for-beginners-real-world-coding-in-html-css/,Beginner,Web Development,451,1163,578
Reverse Engineer,Reverse Engineering and Exploit Development,https://www.ringzer0team.com/challenges,Intermediate/Advanced,Cybersecurity/Reverse Engineering,452,981,177
Reverse Engineer,Binary Exploitation / Reverse Engineering,https://tryhackme.com/paths,Beginner/Intermediate,Cybersecurity/Reverse Engineering,452,168,177
Risk Analyst,Financial Risk Manager (FRM) Part I,https://www.garp.org/frm/overview,Advanced,Risk Management,453,467,479
Risk Analyst,Professional Risk Manager (PRM) Certification,https://prmia.org/certification,Intermediate,Risk Management,453,940,479
Risk Analyst,Credit Risk Modeling,https://www.edx.org/course?search_query=credit+risk+modeling,Intermediate,Risk Management,453,338,479
Robotic Process Automation (RPA) Tester,Software Testing Masterclass (2025) - From Novice to Expert,https://www.udemy.com/course/software-testing-masterclass-from-novice-to-expert/?couponCode=ST1MT31025G3,Intermediate,Software Testing,454,1047,522
Robotic Process Automation (RPA) Tester,Rest API Testing (Automation) from Scratch-Rest Assured Java,https://www.udemy.com/course/rest-api-automation-testing-rest-assured/?couponCode=ST1MT31025G3,Intermediate,API Testing,454,980,20
Robotic UI Tester,Introduction to Robot Framework,https://robotframework.org/,Beginner,Robotic Process Automation,455,669,481
Robotic UI Tester,Selenium WebDriver with Python,https://www.udemy.com/topic/selenium-webdriver/,Intermediate,Test Automation,455,1019,547
Robotic UI Tester,UI Test Automation with Robot Framework and SeleniumLibrary,https://robotframework.org/SeleniumLibrary/,Intermediate,UI Testing,455,1125,551
Robotic UI Tester,CI/CD with Robot Framework and Jenkins,https://www.jenkins.io/,Intermediate,DevOps / Test Automation,455,249,251
Robotics Engineer,Control of Mobile Robots,https://www.coursera.org/learn/mobile-robot,Intermediate,Robotics,456,329,482
Robotics Engineer,Motion Planning for Mobile Robots,https://www.coursera.org/learn/motion-planning-self-driving-cars,Advanced,Robotics,456,836,482
Robotics Engineer,Robot Operating System (ROS),https://www.udemy.com/course/ros-essentials/,Intermediate,Robotics,456,984,482
Robotics Engineer,Introduction to Self-Driving Cars,https://www.udacity.com/course/self-driving-car-engineer-nanodegree--nd013,Advanced,Robotics/Autonomous Systems,456,671,485
Robotics Engineer,Computer Vision Fundamentals,https://www.coursera.org/specializations/computer-vision,Intermediate,Computer Vision (related to Robotics),456,321,124
Robotics Motion Control Engineer,Robotics,https://www.edx.org/course/robotics-2,Intermediate,Robotics,457,985,482
Robotics Motion Control Engineer,Introduction to Robotics,https://ocw.mit.edu/courses/2-12-introduction-to-robotics-fall-2005/pages/assignments/,Advanced,Robotics,457,670,482
Robotics Motion Control Engineer,Artificial Intelligence for Robotics,https://www.udacity.com/course/introduction-to-robotics--cs373,Intermediate,Robotics,457,141,482
Rule-Based Automation Software Engineer ,Automating with PowerShell,https://www.microsoft.com/en-us/learning/powershell-scripting.aspx,Intermediate,Automation & Scripting,458,156,33
Rule-Based Automation Software Engineer ,AWS Certified Cloud Practitioner,https://aws.amazon.com/certification/certified-cloud-practitioner/,Beginner,Cloud Computing,458,25,66
Rule-Based Automation Software Engineer ,Logic and Discrete Mathematics,https://www.coursera.org/learn/logic-introduction,Intermediate,Computer Science Fundamentals,458,740,119
Runtime Application Self-Protection (RASP) Engineer,Reverse Engineering and Malware Analysis,https://www.cybrary.it/course/malware-analysis/,Advanced,Cybersecurity,459,982,142
Rust Systems Engineer,Rust Programming Language,https://doc.rust-lang.org/book/,Beginner,Systems Programming,460,987,539
Rust Systems Engineer,Rustlings Course,https://github.com/rust-lang/rustlings,Beginner,Systems Programming,460,988,539
Rust Systems Engineer,Programming WebAssembly with Rust,https://rustwasm.github.io/book/,Intermediate,WebAssembly Development,460,944,600
Rust Systems Engineer,Embedded Rust by Georgia Tech,https://github.com/rust-embedded/discovery,Intermediate,Embedded Systems,460,446,291
Rust Systems Engineer,The Rustonomicon,https://doc.rust-lang.org/nomicon/,Advanced,Systems Programming,460,1109,539
SCADA Security Specialist,Fundamentals of Industrial Control Systems Security,https://www.sans.org/courses/ics410-ics-scada-security-essentials,Intermediate,Cybersecurity/Industrial Control Systems,461,489,168
SCADA Security Specialist,Implementing and Auditing Industrial Control Systems Security,https://www.sans.org/courses/ics515-ics-active-defense-and-incident-response,Advanced,Cybersecurity/Industrial Control Systems,461,591,168
SCADA Security Specialist,Applied ICS Security: Implementing IEC 62443,https://www.sans.org/courses/ics456-applied-ics-security,Advanced,Cybersecurity/Industrial Control Systems,461,133,168
SDN Engineer,ONOS: SDN Controller from ON.Lab,https://onosproject.org/training/,Advanced,Networking,462,886,421
SQL Developer,Oracle PL/SQL Fundamentals,https://www.oracle.com/database/technologies/appdev/plsql.html#training,Intermediate,Database Programming,463,901,233
Satellite Communications Engineer,"NOC:Satellite Communication Systems, IIT Kharagpur",https://nptel.ac.in/courses/117105131,Beginner,Telecommunications,464,857,544
Satellite Data Processing Engineer,Google Earth Engine Fundamentals,https://developers.google.com/earth-engine/tutorials,Intermediate,Geospatial Data Analysis,465,521,329
Satellite Data Processing Engineer,Fundamentals Of Computer Vision & Image Processing,https://opencv.org/university/fundamentals-of-computer-vision-and-image-processing/,Intermediate,Image Processing,465,477,350
Satellite Systems Engineer,GPS and GNSS for Geospatial Professionals,https://www.e-education.psu.edu/geog862/,Intermediate,GNSS/GPS,466,497,317
Satellite Systems Engineer,"NOC:Satellite Attitude Dynamics and Control, IIT Kharagpur",https://nptel.ac.in/courses/101105077,Intermediate,Aerospace Engineering,466,856,24
Scalable Data Caching Engineer,Redis Essentials,https://redis.io/docs/getting-started/,Beginner,Databases/Caching,467,972,239
Scalable Data Caching Engineer,Memcached Tutorial,https://memcached.org/tutorial,Beginner,Databases/Caching,467,775,239
Scalable Data Caching Engineer,Memcached Tutorial,https://www.tutorialspoint.com/memcached/index.htm,Beginner,Databases/Caching,467,775,239
Scalable Data Infrastructure Engineer,Spark and Python for Big Data with PySpark,https://www.udemy.com/course/spark-and-python-for-big-data-with-pyspark/,Intermediate,Data Engineering,468,1055,186
Secure Boot Engineer,Implementing Secure Boot,https://www.edx.org/learn/embedded-systems,Intermediate,Embedded Systems Security,469,588,294
Secure Boot Engineer,UEFI Secure Boot Deep Dive,https://www.edx.org/learn/computer-security,Advanced,Firmware Security,469,1123,308
Secure Boot Engineer,Linux Kernel Internals and Secure Boot,https://www.edx.org/learn/linux,Intermediate,Operating Systems,469,734,429
Secure Boot Engineer,Secure Boot and Measured Boot in Modern Systems,https://www.sans.org/cyber-security-courses/,Intermediate,System Security,469,1004,538
Secure Cloud Key Management Engineer,Microsoft Azure Key Vault,https://learn.microsoft.com/en-us/azure/key-vault/,Intermediate,Cloud Security,470,795,103
Secure Cloud Key Management Engineer,Applied Cryptography,https://www.schneier.com/book-applied/,Advanced,Cryptography,470,129,138
Secure Data Erasure Specialist,Information and Media Sanitization Training by Darik's Boot and Nuke (DBAN),https://dban.org/,Beginner,Data Security/Data Sanitization,471,599,216
Secure Data Transmission Engineer,Network Security Fundamentals,https://www.cybrary.it/course/comptia-security-plus/,Beginner,Cybersecurity,472,873,142
Secure Data Transmission Engineer,Implementing and Administering Cisco Solutions (CCNA),https://www.netacad.com/courses/ccna,Intermediate,Network Administration,472,590,411
Secure Data Transmission Engineer,Ethical Hacking,https://www.cybrary.it/course/ethical-hacking/,Intermediate,Cybersecurity,472,453,142
Secure Microservices Architect,Building Microservices with Spring Boot and Spring Cloud,https://www.udemy.com/course/building-microservices-with-spring-boot-and-spring-cloud/,Intermediate,Software Development/Microservices,473,200,515
Secure Microservices Architect,The Nuts and Bolts of OAuth 2.0,https://www.udemy.com/course/oauth-2-simplified/,Intermediate,Security/API Development,473,1107,498
Secure Multi-Tenancy Engineer,Multi-Tenant Applications with Kubernetes,https://kubernetes.io/docs/concepts/security/multi-tenancy/,Intermediate,Cloud Computing / Containerization,474,842,69
Secure Multi-Tenancy Engineer,Building Secure and Isolated Tenants with AWS VPCs,https://aws.amazon.com/vpc/,Intermediate,Cloud Computing / Security,474,217,73
Secure Multi-Tenancy Engineer,Identity and Access Management (IAM) for Multi-Tenant Systems,https://aws.amazon.com/iam/,Intermediate,Cloud Computing / Security,474,580,73
Secure Multi-Tenancy Engineer,Identity and Access Management (IAM) Deep Dive,https://docs.aws.amazon.com/IAM/latest/UserGuide/introduction.html,Intermediate,Cloud Security/Identity Management,474,579,108
Secure Network Protocol Engineer,CCNP Security: Implementing and Operating Cisco Security Core Technologies (SCOR 350-701),https://learningnetwork.cisco.com/s/ccnp-security,Advanced,Network Security,475,247,418
Secure Progressive Web App (PWA) Developer,Progressive Web App Development,https://www.udacity.com/course/offline-web-applications--ud899,Intermediate,Web Development,476,946,578
Secure Progressive Web App (PWA) Developer,Introduction to Service Workers,https://developers.google.com/web/fundamentals/primers/service-workers,Intermediate,Web Development,476,672,578
Secure Progressive Web App (PWA) Developer,Caching Strategies with Service Workers,https://web.dev/offline-cookbook/,Advanced,Web Development,476,255,578
Secure Progressive Web App (PWA) Developer,Secure Coding Practices,https://owasp.org/www-project-secure-coding-practices-quick-reference-guide/,Intermediate,Web Security,476,1006,597
Secure Progressive Web App (PWA) Developer,Building PWAs with Angular,https://angular.io/guide/service-worker-getting-started,Intermediate,Web Development,476,204,578
Secure Software Development Lifecycle (SSDLC) Consultant,Secure Coding Practices,https://www.cybrary.it/course/secure-coding-fundamentals/,Intermediate,Software Development/Security,477,1006,517
Secure Software Development Lifecycle (SSDLC) Consultant,Software Security Champion,https://www.sans.org/courses/software-security-champion/,Intermediate,Cybersecurity/Software Development,477,1046,178
Secure Software Development Lifecycle (SSDLC) Consultant,Developing Secure Software using Microsoft SDL,https://www.microsoft.com/en-us/securityengineering/sdl/training,Intermediate,Software Development/Security,477,410,517
Secure Software Development Lifecycle (SSDLC) Consultant,(ISC)- CSSLP - Certified Secure Software Lifecycle Professional,https://www.isc2.org/Certifications/CSSLP,Advanced,Cybersecurity Certification/Software Development,477,0,149
Security Architect,Certified Cloud Security Professional (CCSP),https://www.isc2.org/Certifications/CCSP,Advanced,Cloud Security,478,259,103
Security Architect,(ISC)- Certified Authorization Professional (CAP),https://www.isc2.org/certifications/cap,Intermediate,Risk Management and Compliance,478,1,480
Security Architect,SANS Institute: SEC540: Cloud Security and DevOps Automation,https://www.sans.org/courses/sec540,Advanced,Cloud Security and DevOps,478,990,105
Security Automation Engineer,Automating Security with Ansible,https://www.ansible.com/resources/courses/ansible-security-automation,Intermediate,Security Automation,479,154,495
Security Automation Engineer,Introduction to DevSecOps,https://www.sans.org/courses/devsecops-essentials,Beginner,DevSecOps,479,629,265
Security Awareness Trainer,Security Awareness Training: The Human Factor,https://www.sans.org/security-awareness-training/,Intermediate,Cybersecurity Awareness,480,1014,147
Security Awareness Trainer,Phishing and Email Security Awareness,https://www.proofpoint.com/us/security-awareness-training,Beginner,Cybersecurity Awareness,480,918,147
Security Data Scientist,Intrusion Detection In-Depth,https://www.sans.org/courses/intrusion-detection-in-depth,Intermediate,Cybersecurity/Intrusion Detection,481,686,169
Security Data Scientist,Security Analytics and Operations,https://www.splunk.com/en_us/training/courses.html#security,Intermediate,Security Analytics,481,1013,494
Security Engineer,Practical Ethical Hacking - The Complete Course,https://www.udemy.com/course/practical-ethical-hacking/,Intermediate,Cybersecurity,482,926,142
Security Engineer,(ISC)- Certified Information Systems Security Professional (CISSP),https://www.isc2.org/Certifications/CISSP,Advanced,Cybersecurity Certification,482,2,148
Security Engineer,CompTIA Security+,https://www.comptia.org/certifications/security,Intermediate,Cybersecurity Certification,482,308,148
Security Engineer,AWS Certified Security - Specialty,https://aws.amazon.com/certification/certified-security-specialty/,Advanced,Cloud Security Certification,482,31,104
Security Engineer,Offensive Security Certified Professional (OSCP),https://www.offensive-security.com/pwk-oscp/,Advanced,Cybersecurity,482,888,142
Security Forensics Analyst,"Advanced Network Forensics: Threat Hunting, Analysis, and Incident Response",https://www.sans.org/cyber-security-courses/advanced-network-forensics-threat-hunting-incident-response/,Advanced,Cybersecurity/Digital Forensics,483,78,160
Security Forensics Analyst,Automating DFIR with Python,https://www.sans.org/courses/automating-dfir-with-python-automating-information-security-with-python/,Intermediate,Cybersecurity/DFIR Automation,483,152,159
Security Forensics Analyst,Mobile Forensics,https://www.sans.org/courses/mobile-forensics-in-depth/,Intermediate,Cybersecurity/Mobile Forensics,483,813,171
Security Incident Manager,Certified Incident Handler (ECIH),https://www.eccouncil.org/programs/certified-incident-handler-ecih/,Intermediate,Cybersecurity,484,266,142
Security Incident Responder,Computer Security Incident Response Team (CSIRT),https://www.eccouncil.org/programs/computer-security-incident-response-team-csirt/,Intermediate,Cybersecurity,485,320,142
Security Information and Event Management (SIEM) Engineer,Splunk Fundamentals 2,https://www.splunk.com/en_us/training/courses/splunk-fundamentals-2.html,Intermediate,SIEM Administration,486,1058,488
Security Information and Event Management (SIEM) Engineer,IBM QRadar SIEM Fundamentals,https://www.ibm.com/training/course/AN310G,Beginner,SIEM Administration,486,570,488
Security Information and Event Management (SIEM) Engineer,Elastic Stack: The Basics,https://www.elastic.co/training/elasticsearch-engineer-i,Beginner,SIEM Administration/Log Management,486,443,489
Security Information and Event Management (SIEM) Engineer,SANS SEC555: SIEM with Tactical Analytics,https://www.sans.org/course/siem-with-tactical-analytics,Advanced,Security Analysis/Threat Hunting,486,992,493
Security Monitoring Specialist,Security Onion Essentials,https://securityonion.net/training/,Intermediate,Network Security Monitoring,487,1016,419
Security Operations Center (SOC) Analyst,Cybersecurity Analyst+ (CySA+),https://www.comptia.org/certifications/cybersecurity-analyst,Intermediate,Cybersecurity Certification,488,344,148
"Security Orchestration, Automation, and Response (SOAR) Engineer",Splunk SOAR Training,https://www.splunk.com/en_us/training/courses.html?filter=product%3ASplunk%20SOAR,Intermediate,Cybersecurity / SOAR / Splunk,489,1059,146
"Security Orchestration, Automation, and Response (SOAR) Engineer",IBM Resilient SOAR Training,https://www.ibm.com/security/security-orchestration-automation-response,Intermediate,Cybersecurity / SOAR / IBM Resilient,489,571,145
"Security Orchestration, Automation, and Response (SOAR) Engineer",Google SIEM & SOAR Learning Path,https://www.cloudskillsboost.google/paths/187,Intermediate,Cybersecurity / SOAR,489,523,144
Security Policy Developer,Information Security Policy Development and Implementation,https://www.sans.org/courses/information-security-policy,Intermediate,Cybersecurity,490,596,142
Security Redundancy Engineer,IT Fundamentals for Cybersecurity Specialization,https://www.coursera.org/specializations/it-fundamentals-cybersecurity,Beginner,Cybersecurity,491,573,142
Security Risk Analyst,Cybersecurity Risk Management on edX,https://www.edx.org/learn/cybersecurity,Intermediate,Cybersecurity and Risk Management,492,348,152
Security Software Developer,OWASP Top 10 Web Application Security Risks,https://owasp.org/www-project-top-ten/,Intermediate,Web Security,493,887,597
Security Tester,Mobile Application Security and Penetration Testing,https://www.sans.org/cyber-security-courses/mobile-device-security-ethical-hacking/,Intermediate,Mobile Security,494,811,400
Security Tester,Advanced Web Attacks and Exploitation (AWAE),https://www.offensive-security.com/awae-oswe/,Advanced,Web Application Security,494,96,577
Security Testing Engineer,Certified Mobile Application Security Tester (MAST),https://www.eccouncil.org/programs/certified-mobile-application-security-tester-mast/,Intermediate,Mobile Security,495,272,400
Security Threat Hunter,Elastic Security: Essentials,https://www.elastic.co/training/elastic-security-essentials,Beginner,"Cybersecurity, Data Analysis",496,442,153
Security Token Specialist,Fintech: Foundations & Applications of Financial Technology,https://www.coursera.org/specializations/wharton-fintech,Intermediate,Finance/Fintech,497,469,306
Security Token Specialist,Blockchain and Security Tokens,https://www.coursera.org/specializations/blockchain-revolution-enterprise,Intermediate,Blockchain & Cryptocurrency,497,181,51
Security Token Specialist,PKCS #11: Cryptographic Token Interface Standard,https://docs.oasis-open.org/pkcs11/pkcs11-base/v3.0/pkcs11-base-v3.0.html,Advanced,Cryptography,497,904,138
