job_role,course_name,course_link,difficulty_level,category,job_role_encoded,course_name_encoded,category_encoded
5G Core Network Engineer,"NOC:Optical Wireless Communications for Beyond 5G Networks and IoT, IIIT Delhi",https://nptel.ac.in/courses/108106190,Intermediate,Telecommunications,0,853,544
5G Engineer,"NOC:Evolution of Air Interface towards 5G, IIT Kharagpur",https://nptel.ac.in/courses/108105134,Advanced,Telecommunications,1,852,544
6G Wireless Communication Researcher,"NOC:Enabling Technologies for 6G Communications Networks (Hindi), IIIT Delhi",https://nptel.ac.in/courses/108106588,Advanced,Wireless Communications,2,851,602
AI Bias Auditor,Bias Detection in Natural Language Processing,https://developers.google.com/machine-learning/fairness-overview,Advanced,Natural Language Processing,3,163,407
AI Data Pipeline Engineer,Machine Learning Engineering for Production (MLOps) Specialization,https://www.deeplearning.ai/courses/machine-learning-engineering-for-production-mlops/,Intermediate,MLOps,4,746,373
AI Ethics Consultant,AI for Everyone,https://www.deeplearning.ai/courses/ai-for-everyone/,Beginner,AI Foundations,5,8,8
AI Ethics Consultant,Bias and Fairness in AI,https://developers.google.com/machine-learning/crash-course/fairness/video-lecture,Intermediate,AI Fairness,5,164,6
AI Ethics Policy Developer,The Ethics of Artificial Intelligence,https://www.coursera.org/learn/ethics-of-artificial-intelligence,Beginner,AI Ethics,6,1103,4
AI Explainability Specialist,"Fairness, Accountability, Transparency, and Ethics in AI",https://ethics.fast.ai/,Intermediate,AI Ethics and Explainability,7,461,5
AI Explainability Specialist,Introduction to Responsible AI,https://learn.microsoft.com/en-us/training/modules/responsible-ai-principles/,Beginner,Artificial Intelligence,7,667,29
AI Model Deployment Specialist,Docker for Data Science,https://www.udemy.com/topic/docker/,Intermediate,DevOps/AI/ML Engineering,8,427,254
AI Model Distillation Engineer,Model Compression,https://huggingface.co/course/chapter7/5?fw=pt,Intermediate,Deep Learning/Model Optimization,9,816,246
AI Model Distillation Engineer,Pruning and Quantization,https://docs.nvidia.com/deeplearning/tensorrt/developer-guide/index.html#pruning_chapter,Advanced,Deep Learning/Model Optimization,9,949,246
AI Model Distillation Engineer,Introduction to TensorFlow Lite,https://www.tensorflow.org/lite/tutorials,Beginner,Mobile Deep Learning,9,677,397
AI Model Explainability Tester,Black-Box Software Testing,https://bbst.courses/,Intermediate,Software Testing,10,173,522
AI Model Explainability Tester,Applied Machine Learning: Foundations,https://www.linkedin.com/learning/applied-machine-learning-foundations,Intermediate,Machine Learning Fundamentals,10,134,379
AI Model Risk Specialist,Explainable AI (XAI),https://www.coursera.org/learn/explainable-ai,Advanced,Artificial Intelligence,11,455,29
AI Model Risk Specialist,Building Reliable Machine Learning Models,https://developers.google.com/machine-learning/crash-course/production-ml-systems,Advanced,"Machine Learning, MLOps",11,207,382
AI Model Trainer,TensorFlow Developer Professional Certificate,https://www.coursera.org/professional-certificates/tensorflow-in-practice,Intermediate,Machine Learning,12,1080,374
AI Model Trainer,Generative Adversarial Networks (GANs) Specialization,https://www.coursera.org/specializations/generative-adversarial-networks-gans,Advanced,Deep Learning,12,501,243
AI Researcher,Probabilistic Graphical Models Specialization,https://www.coursera.org/specializations/probabilistic-graphical-models,Advanced,Probabilistic Modeling,13,937,449
AI Researcher,CS224N: Natural Language Processing with Deep Learning,https://web.stanford.edu/class/cs224n/,Advanced,Natural Language Processing,13,250,407
AI-Based Graph Query Optimizer,Discrete Optimization,https://www.coursera.org/learn/discrete-optimization,Intermediate,Mathematics/Computer Science,14,423,393
AI-Based Graph Query Optimizer,"Theory of Automata, Formal Languages and Computation, IIT Madras",https://nptel.ac.in/courses/106/106/106106049/,Advanced,Computer Science,14,1115,118
AI-Based Graph Query Optimizer,Algorithms Specialization,https://www.coursera.org/specializations/algorithms,Intermediate,Algorithms,14,103,26
AI-Based Industrial Automation Engineer,AI for Robotics,https://www.udacity.com/course/ai-for-robotics--cs373,Advanced,Robotics/AI,15,11,484
AI-Based Industrial Automation Engineer,"Modern Robotics: Mechanics, Planning, and Control Specialization",https://www.coursera.org/specializations/modernrobotics,Advanced,Robotics/Control Systems,15,825,486
AI-Driven Drug Repurposing Engineer,Drug Discovery,https://www.coursera.org/learn/drug-discovery,Beginner,Pharmaceutical Sciences,16,434,443
AI-Driven Ethical Investment Analyst,Sustainable Investing and ESG Analysis,https://www.cfainstitute.org/en/programs/esg-investing,Intermediate,Sustainable Finance,17,1071,534
AI-Driven Ethical Investment Analyst,Financial Modeling and Valuation Analyst (FMVA),https://corporatefinanceinstitute.com/certifications/financial-modeling-valuation-analyst-fmva-program,Intermediate,Financial Analysis,17,466,307
AI-Driven Ethical Investment Analyst,Data Science Ethics,https://www.coursera.org/learn/data-science-ethics,Beginner,Data Ethics,17,365,189
AI-Driven Market Analyst,Marketing Analytics,https://www.coursera.org/specializations/marketing-analytics,Intermediate,Marketing Analytics,18,759,386
AI-Driven Market Analyst,Data Analysis with Python,https://www.coursera.org/specializations/data-analysis-python,Intermediate,Data Science,18,355,202
AI-Driven Network Automation Engineer,Network Programmability and Automation,https://www.netacad.com/courses/programming/networking-programmability-automation,Beginner,Network Automation,19,870,413
AI-Driven Network Congestion Engineer,Fundamentals of Computer Network Congestion Control,https://www.coursera.org/specializations/networking-basics,Intermediate,Network Engineering,20,481,414
AI-Driven Network Congestion Engineer,Introduction to Machine Learning for Networking,https://www.udacity.com/course/intro-to-machine-learning--ud120,Intermediate,Machine Learning,20,655,374
AI-Driven Network Congestion Engineer,Deep Reinforcement Learning for Network Optimization,https://www.deepmind.com/learning-resources,Advanced,Deep Learning,20,385,243
AI-Driven Network Congestion Engineer,Optimization Algorithms for Network Resource Allocation,https://www.edx.org/micromasters/mitx-supply-chain-management,Advanced,Optimization,20,896,433
AI-Driven Network Congestion Engineer,Time Series Analysis for Network Traffic Prediction,https://www.udemy.com/topic/time-series-analysis/,Intermediate,Data Science,20,1118,202
AI-Driven Personalization Engineer,MLOps (Machine Learning Operations) Fundamentals,https://www.cloudacademy.com/course/mlops-machine-learning-operations-fundamentals-468/,Intermediate,Machine Learning Operations,21,742,380
AI-Driven Personalized Recommendation Engineer,Building Recommender Systems with Machine Learning and AI,https://www.udemy.com/course/recommender-systems/,Intermediate,Data Science/Machine Learning,22,206,213
AI-Driven Traffic Shaping Engineer,Traffic Flow Theory and Characteristics,https://www.trb.org/Main/Blurbs/180554.aspx,Intermediate,Traffic Engineering,23,1119,549
AI-Generated Code Verifier,Secure Code Review Techniques,https://www.sans.org/courses/secure-code-review-techniques,Advanced,Security,24,1005,492
AI-Generated Content Engineer,Prompt Engineering for ChatGPT,https://www.deeplearning.ai/short-courses/chatgpt-prompt-engineering-for-developers/,Beginner,AI/Prompt Engineering,25,948,16
AI-Generated Content Moderator,Bias and Fairness in AI,https://developers.google.com/machine-learning/crash-course/fairness,Intermediate,AI Ethics,26,164,4
AI-Generated Synthetic Voice Engineer,Acoustic Phonetics,https://www.edx.org/course?search_query=acoustic+phonetics,Intermediate,Linguistics,27,47,368
AI-Generated Synthetic Voice Engineer,Digital Signal Processing,https://www.coursera.org/specializations/digital-signal-processing,Intermediate,Signal Processing,27,419,499
AI-Optimized Network Function Virtualization (NFV) Engineer,Introduction to Cloud-Native NFV,https://www.cncf.io/certification/ckad/,Advanced,Cloud-Native/NFV,28,619,109
AI-Optimized Network Function Virtualization (NFV) Engineer,Virtualization Concepts,https://www.vmware.com/education-services/certification/vcp-dcv.html,Beginner,Virtualization,28,1150,571
AI-Optimized Query Processing Engineer,Intro to Artificial Intelligence,https://www.udacity.com/course/intro-to-artificial-intelligence--cs271,Intermediate,Artificial Intelligence,29,608,29
AI-Powered Anomaly Detection Engineer,Practical Time Series Analysis,https://www.coursera.org/learn/practical-time-series-analysis,Intermediate,Data Science/Time Series Analysis,30,929,215
AI-Powered Bandwidth Optimization Engineer,Optimization Algorithms in Machine Learning,https://www.edx.org/learn/machine-learning,Advanced,Machine Learning,31,897,374
AI-Powered Chip Designer,Computer Architecture,https://www.coursera.org/learn/comparch,Intermediate,Computer Architecture,32,318,116
AI-Powered Cloud Cost Optimization Engineer,Cloud Financial Management,https://www.aws.training/learning-paths/financial-management,Intermediate,Cloud Computing / Cost Optimization,33,295,70
AI-Powered Cloud Security Engineer,Microsoft Certified: Azure Security Engineer Associate,https://learn.microsoft.com/en-us/certifications/azure-security-engineer/,Intermediate,Cloud Security,34,801,103
AI-Powered Cloud Security Engineer,Applied AI Security,https://www.sans.org/courses/applied-ai-security-mlai,Advanced,AI Security,34,128,12
AI-Powered Code Completion Engineer,Code Generation with Large Language Models,https://huggingface.co/learn/nlp-course/chapter7/6?fw=pt,Intermediate,Natural Language Processing / Code Generation,35,302,408
AI-Powered Code Completion Engineer,Transformers for Natural Language Processing,https://huggingface.co/course/chapter1/1,Intermediate,Natural Language Processing / Transformers,35,1121,409
AI-Powered Conversational Web Developer,Web Development Fundamentals,https://www.freecodecamp.org/learn/responsive-web-design/,Beginner,Web Development,36,1164,578
AI-Powered Conversational Web Developer,React.js for Conversational Interfaces,https://www.udemy.com/topic/react/,Intermediate,Front-End Web Development,36,964,312
AI-Powered Conversational Web Developer,Voice User Interface Design,https://www.interaction-design.org/literature/article/5-things-you-need-to-know-to-design-voice-user-interfaces,Beginner,UX/UI Design,36,1153,558
AI-Powered Data Deduplication Engineer,Building Scalable Data Pipelines with Apache Spark,https://www.edx.org/learn/big-data,Intermediate,Big Data,37,212,39
AI-Powered DevOps Engineer,Machine Learning for DevOps Engineers,https://www.cloudacademy.com/course/machine-learning-for-devops-engineers-4829/,Intermediate,DevOps & Machine Learning,38,748,250
AI-Powered Disaster Response Engineer,Disaster Risk Reduction in a Changing Climate,https://www.futurelearn.com/courses/disaster-risk-reduction,Intermediate,Disaster Response,39,422,271
AI-Powered Disaster Response Engineer,Remote Sensing,https://www.esri.com/training/catalog/57630422851d31e02a43f13f/fundamentals-of-remote-sensing/,Intermediate,Geospatial Analysis,39,977,328
AI-Powered Disaster Response Engineer,Unmanned Aircraft Systems (UAS) for Disaster Response,https://training.fema.gov/is/crslist.aspx?all=true,Intermediate,Disaster Response,39,1136,271
AI-Powered Document Understanding Engineer,Deep Learning for Computer Vision,https://www.udacity.com/course/deep-learning-nanodegree--nd101,Advanced,Computer Vision,40,382,123
AI-Powered Financial Analyst,Financial Modeling and Valuation Analyst (FMVA),https://corporatefinanceinstitute.com/certifications/financial-modeling-valuation-analyst-fmva-program/,Intermediate,Finance/Financial Modeling,41,466,305
AI-Powered Financial Analyst,Python for Finance and Algorithmic Trading,https://www.udemy.com/course/python-for-finance-and-algorithmic-trading/,Intermediate,Programming/Finance,41,955,461
AI-Powered Financial Analyst,Machine Learning for Trading Specialization,https://www.coursera.org/specializations/machine-learning-trading,Advanced,Data Science/Finance,41,751,210
AI-Powered Financial Analyst,Investment Management with Python and Machine Learning Specialization,https://www.coursera.org/specializations/investment-management-python-machine-learning,Intermediate,Data Science/Finance,41,688,210
AI-Powered Fitness Optimization Engineer,Anatomy Specialization,https://www.coursera.org/specializations/anatomy,Intermediate,Human Anatomy,42,106,345
AI-Powered Fraud Detection Engineer,Graph Algorithms for Fraud Detection,https://www.neo4j.com/graphacademy/online-training/graph-algorithms-for-fraud-detection/,Intermediate,Graph Analytics/Fraud Detection,43,529,334
AI-Powered Fraud Detection Engineer,Fraud Analytics using Python,https://www.udemy.com/topic/fraud-analytics/,Intermediate,Data Science/Programming,43,474,214
AI-Powered Fraud Detection Engineer,Building a Real-Time Fraud Detection System,https://www.cloudacademy.com/course/building-a-real-time-fraud-detection-system-with-aws/,Advanced,Cloud Computing/Security,43,229,94
AI-Powered Indexing Algorithm Developer,Building Search Applications with Elasticsearch,https://www.elastic.co/training/elasticsearch-engineer,Intermediate,Search Engine Development,44,215,491
AI-Powered Indexing Algorithm Developer,Recommender Systems Specialization,https://www.coursera.org/specializations/recommender-systems,Intermediate,Recommender Systems,44,970,476
AI-Powered Internet Traffic Analysis Engineer,Introduction to Networking and Cisco Devices,https://www.netacad.com/courses/networking/introduction-networking-cisco-devices,Beginner,Networking,45,659,421
AI-Powered Internet Traffic Analysis Engineer,Network Analysis using Wireshark,https://www.udemy.com/course/wireshark-tutorial/,Intermediate,Network Analysis,45,868,412
AI-Powered Intrusion Prevention Engineer,Intrusion Detection and Prevention Systems (IDPS),https://www.sans.org/cyber-security-courses/intrusion-detection-in-depth/,Intermediate,Cybersecurity,46,687,142
AI-Powered Legal Tech Developer,Introduction to Legal Data Science,https://www.edx.org/course/data-science-ethics,Intermediate,Data Science/Legal Tech,47,651,212
AI-Powered Marketing Automation Engineer,HubSpot Marketing Automation Certification,https://academy.hubspot.com/courses/marketing-automation,Beginner,Marketing Automation,48,560,387
AI-Powered Marketing Automation Engineer,Google Analytics Individual Qualification,https://skillshop.exceedlms.com/student/path/21222-google-analytics-individual-qualification,Intermediate,Marketing Analytics,48,513,386
AI-Powered Mental Health Therapy Chatbot Developer,Introduction to Psychology,https://www.coursera.org/learn/introduction-psychology,Beginner,Psychology,49,663,465
AI-Powered Music Composer,Magenta Studio: Co-Creating Music with AI,https://magenta.tensorflow.org/studio,Intermediate,AI Music Composition,50,753,9
AI-Powered News Generation Engineer,Data Visualization with Python,https://www.coursera.org/learn/python-data-visualization,Beginner,Data Visualization,51,371,220
AI-Powered Patent Analysis Engineer,Introduction to Intellectual Property Law,https://www.coursera.org/learn/introduction-intellectual-property,Beginner,Law,52,648,366
AI-Powered Patent Analysis Engineer,Sequence Models,https://www.coursera.org/learn/nlp-sequence-models,Intermediate,Natural Language Processing,52,1027,407
AI-Powered Political Forecasting Engineer,Applied Data Science with Python Specialization,https://www.coursera.org/specializations/data-science-python,Intermediate,"Data Science, Machine Learning",53,132,204
AI-Powered Political Forecasting Engineer,Natural Language Processing with Python,https://www.nltk.org/book/,Intermediate,Natural Language Processing,53,865,407
AI-Powered Political Forecasting Engineer,Social Network Analysis,https://www.coursera.org/learn/social-network-analysis,Intermediate,"Social Sciences, Network Analysis",53,1040,504
AI-Powered Protein Folding Engineer,Introduction to Protein Structure and Folding,https://www.edx.org/course/principles-of-biochemistry,Intermediate,Biochemistry,54,662,44
AI-Powered Storytelling Developer,Creative Writing: The Craft of Plot,https://www.coursera.org/learn/craft-of-plot,Beginner,Creative Writing,55,337,136
AI-Powered Storytelling Developer,Python for Data Science and AI,https://www.coursera.org/learn/python-for-applied-data-science-ai,Beginner,Data Science,55,953,202
AI-Powered Test Automation Engineer,Applitools Visual AI Rockstar Hackathon,https://applitools.com/hackathon/,Intermediate,Visual Testing,56,135,572
AI-Powered UI Engineer,UX Design Fundamentals,https://www.udemy.com/course/ux-design-fundamentals/,Beginner,UX/UI Design,57,1127,558
AI-Powered UX Optimization Engineer,User Experience Research and Design,https://www.coursera.org/specializations/ux-design,Intermediate,UX Design,58,1143,556
AI-Powered Video Analytics Engineer,OpenCV Course - Learn Computer Vision with Python,https://www.udemy.com/course/python-for-computer-vision-with-opencv-and-deep-learning/,Intermediate,Computer Vision,59,891,123
AI-Powered Video Content Creation Engineer,Advanced AI: Deep Reinforcement Learning in Python,https://www.udemy.com/course/artificial-intelligence-reinforcement-learning-in-python/,Advanced,Deep Learning / AI,60,48,244
AI-Powered Voice Commerce Engineer,E-commerce Foundations,https://www.google.com/search?q=e-commerce+courses+online,Beginner,E-commerce and Business,61,438,274
AI-Powered Voice Commerce Engineer,Speech Recognition using Kaldi,https://kaldi-asr.org/doc/kaldi_for_dummies.html,Advanced,AI and Machine Learning,61,1056,13
AI-Powered Voice Commerce Engineer,Product Management for AI,https://www.udacity.com/course/ai-product-manager-nanodegree--nd088,Intermediate,AI Product Management,61,938,10
AI-Powered Web Accessibility Compliance Engineer,Building AI-Powered Applications with Azure,https://learn.microsoft.com/en-us/training/paths/build-ai-solutions-with-azure-ml-service/,Intermediate,AI Engineering,62,192,3
AI-Powered Web Moderation Engineer,Natural Language Processing with Deep Learning,https://www.coursera.org/specializations/natural-language-processing,Intermediate,Natural Language Processing,63,863,407
AI-Powered Web Moderation Engineer,Machine Learning Engineering for Production (MLOps) Specialization,https://www.deeplearning.ai/program/machine-learning-engineering-for-production-mlops/,Intermediate,Machine Learning Operations,63,746,380
AI-Powered Web Moderation Engineer,Building AI-Powered Chatbots Without Coding,https://www.udemy.com/topic/chatbots/,Beginner,Chatbot Development,63,193,62
AI-Powered Web Moderation Engineer,Advanced Machine Learning with TensorFlow on Google Cloud Platform Specialization,https://www.coursera.org/specializations/advanced-machine-learning-tensorflow-gcp,Advanced,Machine Learning,63,75,374
AI/ML Model Tester,Building and Deploying Machine Learning Powered Applications on AWS,https://aws.amazon.com/training/learning-paths/machine-learning/,Intermediate,Cloud Computing/MLOps,64,234,92
API Developer,Designing RESTful APIs,https://www.udemy.com/course/restful-api-design/,Intermediate,Software Engineering / API Design,65,394,520
API Developer,Building Scalable APIs with GraphQL,https://www.udemy.com/course/graphql-bootcamp/,Intermediate,Web Development / API Development,65,209,585
API Developer,GraphQL with Apollo Server and Express,https://www.udemy.com/course/graphql-with-react-course/,Intermediate,Web Development / API Development,65,535,585
API Gateway Architect,Building APIs with Amazon API Gateway,https://www.aws.training/Details/eLearning?id=62322,Intermediate,Cloud Computing/API Management,66,194,82
API Gateway Architect,API Security Fundamentals,https://www.owasp.org/index.php/OWASP_API_Security_Project,Intermediate,Security,66,15,492
API Gateway Developer,API Security - OWASP API Top 10,https://owasp.org/www-project-api-security/,Intermediate,API Security,67,14,19
API Gateway Developer,Microservices with Spring Boot and Spring Cloud,https://www.udemy.com/topic/spring-cloud/,Intermediate,Microservices/API Development,67,787,395
API Gateway Engineer,Microservices with gRPC: Building Scalable APIs,https://www.udemy.com/topic/grpc/,Intermediate,API Development/Microservices,68,788,18
API Gateway Engineer,API Gateway and Management with Apigee X,https://cloud.google.com/apigee/docs/api-platform/get-started/overview,Intermediate,API Development/Cloud Computing,68,13,17
API Monetization Specialist,API Design,https://www.udacity.com/course/api-design-nanodegree--nd083,Intermediate,Software Engineering,69,12,519
API Monetization Specialist,Business Strategy: Monetizing Products and Services,https://www.coursera.org/specializations/wharton-business-foundations,Intermediate,Business and Management,69,237,59
API Monetization Specialist,Pricing Strategy: Tactics and Analytics,https://www.coursera.org/learn/pricing-strategy,Intermediate,Business and Management,69,931,59
API Performance Tester,Mastering API Performance Testing with Gatling,https://www.udemy.com/course/gatling-performance-testing/,Intermediate to Advanced,Software Testing/Performance Testing,70,761,525
AR Cloud Developer,Introduction to ARCore,https://developers.google.com/ar/develop/unity,Intermediate,AR Development,71,611,22
AR Cloud Developer,Developing AR Apps with ARKit,https://developer.apple.com/documentation/arkit,Intermediate,AR Development,71,401,22
AR/VR Haptic Feedback Engineer,Building Interactive 3D Experiences with WebXR,https://developer.mozilla.org/en-US/docs/Web/API/WebXR_Device_API,Advanced,Web Development,72,199,578
AR/VR Haptic Feedback Engineer,Advanced Robotics: Haptic Feedback and Control,https://www.edx.org/learn/robotics,Advanced,Robotics,72,88,482
ASIC Engineer,"VLSI Design Verification and Test, IIT Guwahati",https://nptel.ac.in/courses/106103016,Intermediate,Electronics Engineering,73,1146,284
ASIC Engineer,"Basic Electronics, IIT Guwahati",https://nptel.ac.in/courses/117/103/117103063/,Intermediate,Electronics Engineering,73,160,284
ASIC Engineer,"NOC:Architectural Design of Digital Integrated Circuits, IIT Kharagpur",https://nptel.ac.in/courses/108105118,Intermediate,Electrical Engineering,73,849,279
Accessibility Compliance Tester,Accessibility for Web Design,https://www.linkedin.com/learning/accessibility-for-web-design,Intermediate,Web Development,74,43,578
Adaptive Optics Engineer,Control of Adaptive Optics Systems,https://www.spiedigitallibrary.org/conference-proceedings-of-spie/5490/0000/Control-of-adaptive-optics-systems/10.1117/12.550746.short,Advanced,Control Systems Engineering,75,328,133
Adaptive Optics Engineer,Wavefront Sensing and Control,https://www.spiedigitallibrary.org/ebooks/PM/Practical-Adaptive-Optics/Wavefront-Sensing-and-Control/10.1117/3.1000826.ch4,Intermediate,Optics/Signal Processing,75,1160,432
Adaptive Optics Engineer,Introduction to Fourier Optics,https://www.spiedigitallibrary.org/courses/fundamentals-of-fourier-optics,Intermediate,Physics/Optics,75,637,446
Algorithm Engineer,Advanced Algorithms and Complexity,https://www.coursera.org/learn/advanced-algorithms-and-complexity,Advanced,Computer Science,76,50,118
Algorithm Engineer,Graph Algorithms,https://www.coursera.org/learn/algorithms-on-graphs,Intermediate,Computer Science,76,528,118
Algorithm Engineer,Introduction to Algorithms,https://ocw.mit.edu/courses/6-006-introduction-to-algorithms-fall-2011/,Intermediate,Computer Science,76,612,118
Algorithm Engineer,Dynamic Programming - I,https://www.geeksforgeeks.org/dynamic-programming/,Intermediate,Computer Science,76,437,118
Algorithmic Governance Engineer,Algorithmic Toolbox,https://www.coursera.org/learn/algorithmic-toolbox,Intermediate,Computer Science,77,102,118
Algorithmic Governance Engineer,Algorithmic Fairness,https://fairmlbook.org/,Advanced,AI Fairness and Bias,77,101,7
Android Developer,The Complete Android 14 & Kotlin Development Masterclass,https://www.udemy.com/course/android-kotlin-developer/,Intermediate,Mobile Development,78,1095,398
Android Developer,Android App Development Masterclass using Kotlin,https://www.udemy.com/course/android-oreo-kotlin-app-masterclass/,Intermediate,Mobile Development,78,108,398
Android Developer,Advanced Android in Kotlin,https://developer.android.com/courses/kotlin-android-advanced/overview,Intermediate,Mobile Development,78,52,398
Android Developer,Developing Android Apps with Kotlin,https://www.udacity.com/course/developing-android-apps-with-kotlin--ud9012,Intermediate,Mobile Development,78,403,398
Angular Developer,Angular - The Complete Guide (2025 Edition),https://www.udemy.com/course/the-complete-guide-to-angular-2/,Beginner to Advanced,Web Development,79,110,578
Angular Developer,Angular Advanced Masterclass & FREE E-Book,https://www.udemy.com/course/angular-advanced-masterclass/,Advanced,Web Development,79,111,578
Angular Developer,Angular NgRx: Getting Started,https://www.pluralsight.com/courses/angular-ngrx-getting-started,Intermediate,Web Development,79,112,578
Angular Developer,RxJS in Angular: Reactive Development,https://www.pluralsight.com/courses/rxjs-angular-reactive-development,Intermediate,Web Development,79,989,578
Application Security Hardening Engineer ,Advanced Application Security,https://www.sans.org/sec541,Advanced,Application Security,80,54,28
Asynchronous Programming Specialist,Asynchronous Programming with Python,https://realpython.com/async-io-python/,Intermediate,Software Development/Python,81,145,516
Asynchronous Programming Specialist,Async and Await,https://learn.microsoft.com/en-us/dotnet/csharp/programming-guide/concepts/async/,Intermediate,Software Development/C#,81,143,509
